{
  "$schema": "https://json-schema.org/draft/2020-12/schema",
  "$id": "project-engineering-os/debt-control/config",
  "title": "Politica de control de deuda tecnica (.project-os/debt/config.json)",
  "description": "Documentacion machine-readable del contrato. La validacion ejecutable vive en src/schema.mjs y es la fuente normativa.",
  "type": "object",
  "required": ["schemaVersion", "budget", "triggers", "github", "plans", "planRouting", "allowlistLabels"],
  "properties": {
    "schemaVersion": { "const": 1 },
    "budget": {
      "type": "object",
      "required": ["threshold", "minorUnits", "escalatedMinorUnits"],
      "properties": {
        "threshold": { "type": "integer", "minimum": 0, "description": "Unidades que pausan el plan (politica aprobada: 5)." },
        "minorUnits": { "type": "integer", "minimum": 0, "description": "Unidades de un Minor normal (politica aprobada: 1)." },
        "escalatedMinorUnits": { "type": "integer", "minimum": 0, "description": "Unidades de un Minor recurrente o transversal (politica aprobada: 2)." }
      }
    },
    "triggers": {
      "type": "object",
      "required": ["flowsWithResidualDebt", "recurrenceFlows"],
      "properties": {
        "flowsWithResidualDebt": { "type": "integer", "minimum": 1, "description": "Flujos SDD distintos con deuda residual que disparan saneamiento (5)." },
        "recurrenceFlows": { "type": "integer", "minimum": 1, "description": "Flujos distintos en los que un mismo hallazgo dispara recurrencia (3)." }
      }
    },
    "github": {
      "type": "object",
      "required": ["mode"],
      "properties": {
        "mode": { "enum": ["required", "advisory", "off", "auto"], "description": "auto resuelve a required si existe el manifest de Project OS de GitHub, si no a off." },
        "repo": { "type": "string" },
        "remediationLabel": { "type": "string" },
        "issueTitlePrefix": { "type": "string" },
        "projectManifest": { "type": "string", "description": "Ruta relativa del manifest que activa auto->required (default .project-os/github/product-os.json)." }
      }
    },
    "plans": {
      "type": "array",
      "minItems": 1,
      "items": {
        "type": "object",
        "required": ["id", "title"],
        "properties": {
          "id": { "type": "string", "pattern": "^[a-z0-9][a-z0-9-]*$" },
          "title": { "type": "string" },
          "doc": { "type": "string" }
        }
      }
    },
    "planRouting": {
      "type": "object",
      "required": ["labelMap", "default"],
      "properties": {
        "labelMap": { "type": "object", "additionalProperties": { "type": "string" } },
        "default": { "type": ["string", "null"] }
      }
    },
    "allowlistLabels": {
      "type": "array",
      "items": { "type": "string" },
      "description": "Labels de issue que el pre-propose admite con el plan pausado (saneamiento, seguridad, incidentes, rollback)."
    },
    "branchHint": { "type": "string" }
  }
}
